"id","mas_college_stream_id","mas_college_code","mas_college_name","mas_college_canonical_college_id","mas_college_exam_centre","mas_college_type","mas_college_is_internal","mas_college_status_id","created_by","updated_by","created_at","updated_at","deleted_at"
2053,6,AUTO-000988,"Jawaharlal Nehru Medical College, Aligarh",,0,G,3,1,,,"2026-01-22 07:21:55","2026-01-22 07:21:55",
2054,6,AUTO-000989,"Kalyan Singh Government Medical College, Hospital and Kasturba Mahila Chikitsalaya",,0,G,3,1,,,"2026-01-22 07:21:55","2026-01-22 07:21:55",
2055,6,AUTO-000990,"K.D. Medical College Hospital and Research Centre, Mathura",,0,S,3,1,,,"2026-01-22 07:21:55","2026-01-22 07:21:55",
2056,6,AUTO-000991,"King George Medical University, Lucknow",,0,G,3,1,,,"2026-01-22 07:21:55","2026-01-22 07:21:55",
2057,6,AUTO-000992,KMC Medical College and Hospital,,0,T,3,1,,,"2026-01-22 07:21:55","2026-01-22 07:21:55",
2058,6,AUTO-000993,"Krishna Mohan Medical College and Hospital, Mathura",,0,S,3,1,,,"2026-01-22 07:21:56","2026-01-22 07:21:56",
2059,6,AUTO-000994,"LLRM Medical College, Meerut",,0,G,3,1,,,"2026-01-22 07:21:56","2026-01-22 07:21:56",
2060,6,AUTO-000995,"Mahamaya Rajkiya Allopathic Medical College, Ambedkarnagar",,0,G,3,1,,,"2026-01-22 07:21:56","2026-01-22 07:21:56",
2061,6,AUTO-000996,"Maharani Laxmi Bai Medical College, Jhansi",,0,G,3,1,,,"2026-01-22 07:21:56","2026-01-22 07:21:56",
2062,6,AUTO-000997,"Maharshi Devraha Baba Autonomous State Medical College, Deoria",,0,G,3,1,,,"2026-01-22 07:21:56","2026-01-22 07:21:56",
2063,6,AUTO-000998,Mahatma Vidur Autonomous State Medical College,,0,G,3,1,,,"2026-01-22 07:21:56","2026-01-22 07:21:56",
2064,6,AUTO-000999,"Major S D Singh Medical College and Hospital, Fathehgarh, Farrukhabad",,0,T,3,1,,,"2026-01-22 07:21:56","2026-01-22 07:21:56",
2065,6,AUTO-001000,"Mayo Institute of Medical Sciences, Barabanki",,0,T,3,1,,,"2026-01-22 07:21:56","2026-01-22 07:21:56",
2066,6,AUTO-001001,"Moti Lal Nehru Medical College, Allahabad",,0,G,3,1,,,"2026-01-22 07:21:56","2026-01-22 07:21:56",
2067,6,AUTO-001002,"Muzaffarnagar Medical College, Muzaffarnagar",,0,T,3,1,,,"2026-01-22 07:21:56","2026-01-22 07:21:56",
2068,6,AUTO-001003,Naraina Medical College and Research Centre,,0,S,3,1,,,"2026-01-22 07:21:56","2026-01-22 07:21:56",
2069,6,AUTO-001004,"National Capital Region Institute of Medical Sciences, Meerut",,0,S,3,1,,,"2026-01-22 07:21:56","2026-01-22 07:21:56",
2070,6,AUTO-001005,Noida International Institute Of Medical Sciences,,0,T,3,1,,,"2026-01-22 07:21:56","2026-01-22 07:21:56",
2071,6,AUTO-001006,"Prasad Institute of Medical Sciences, Lucknow",,0,T,3,1,,,"2026-01-22 07:21:56","2026-01-22 07:21:56",
2072,6,AUTO-001007,"Rajkiya Allopathic Medical College, Bahraich, UP",,0,G,3,1,,,"2026-01-22 07:21:56","2026-01-22 07:21:56",
2073,6,AUTO-001008,"Rajkiya Medical College Jalaun, Orai, Uttar Pradesh",,0,G,3,1,,,"2026-01-22 07:21:56","2026-01-22 07:21:56",
2074,6,AUTO-001009,"Rajshree Medical Research Institute, Bareilly",,0,T,3,1,,,"2026-01-22 07:21:56","2026-01-22 07:21:56",
2075,6,AUTO-001010,"Rama Medical College and Hospital , Kanpur",,0,T,3,1,,,"2026-01-22 07:21:56","2026-01-22 07:21:56",
2076,6,AUTO-001011,"Rama Medical College Hospital and Research Centre, Hapur",,0,T,3,1,,,"2026-01-22 07:21:56","2026-01-22 07:21:56",
2077,6,AUTO-001012,"Rohilkhand Medical College and Hospital, Bareilly",,0,T,3,1,,,"2026-01-22 07:21:56","2026-01-22 07:21:56",
2078,6,AUTO-001013,"Santosh Medical College, Ghaziabad",,0,T,3,1,,,"2026-01-22 07:21:56","2026-01-22 07:21:56",
2079,6,AUTO-001014,"Saraswati Institute of Medical Sciences, Hapur",,0,T,3,1,,,"2026-01-22 07:21:56","2026-01-22 07:21:56",
2080,6,AUTO-001015,"Saraswati Medical College, Unnao, U.P.",,0,T,3,1,,,"2026-01-22 07:21:56","2026-01-22 07:21:56",
2081,6,AUTO-001016,"School of Medical Sciences and Research,Greater Noida",,0,T,3,1,,,"2026-01-22 07:21:56","2026-01-22 07:21:56",
2082,6,AUTO-001017,"Shaikh-UL-Hind Maulana Mahmood Hasan Medical College, Saharanpur",,0,G,3,1,,,"2026-01-22 07:21:56","2026-01-22 07:21:56",
2083,6,AUTO-001018,Shri Gorakshnath Medical College Hospital and Research Centre,,0,S,3,1,,,"2026-01-22 07:21:56","2026-01-22 07:21:56",
2084,6,AUTO-001019,"Shri Ram Murti Smarak Institute of Medical Sciences, Bareilly",,0,T,3,1,,,"2026-01-22 07:21:56","2026-01-22 07:21:56",
2085,6,AUTO-001020,Shri Siddhi Vinayak Medical College and Hospital,,0,T,3,1,,,"2026-01-22 07:21:56","2026-01-22 07:21:56",
2086,6,AUTO-001021,SKS Hospital Medical College and Research Centre,,0,P,3,1,,,"2026-01-22 07:21:56","2026-01-22 07:21:56",
2087,6,AUTO-001022,"S N Medical College, Agra",,0,G,3,1,,,"2026-01-22 07:21:56","2026-01-22 07:21:56",
2088,6,AUTO-001023,"Subharti Medical College, Meerut",,0,T,3,1,,,"2026-01-22 07:21:56","2026-01-22 07:21:56",
2089,6,AUTO-001024,"Teerthanker Mahaveer Medical College, Moradabad",,0,T,3,1,,,"2026-01-22 07:21:56","2026-01-22 07:21:56",
2090,6,AUTO-001025,"T S Misra Medical College and Hospital, Amusi, Lucknow",,0,P,3,1,,,"2026-01-22 07:21:56","2026-01-22 07:21:56",
2091,6,AUTO-001026,Uma Nath Singh Autonomous State Medical College Society Jaunpur,,0,G,3,1,,,"2026-01-22 07:21:56","2026-01-22 07:21:56",
2092,6,AUTO-001027,"United Institute of Medical Sciences, Allahabad",,0,S,3,1,,,"2026-01-22 07:21:56","2026-01-22 07:21:56",
2093,6,AUTO-001028,"Uttar Pradesh University of Medical Sciences, (Prev. UP Rural Inst.of Med.Sc and R) Etawah",,0,G,3,1,,,"2026-01-22 07:21:56","2026-01-22 07:21:56",
2094,6,AUTO-001029,"Varun Arjun Medical College, Banthra, Shahjahanpur",,0,T,3,1,,,"2026-01-22 07:21:56","2026-01-22 07:21:56",
2095,6,AUTO-001030,"Venkateshwara Institute of Medical Sciences, Gajraula",,0,T,3,1,,,"2026-01-22 07:21:56","2026-01-22 07:21:56",
2096,6,AUTO-001031,"All India Institute of Medical Sciences, Kalyani, Nadia",,0,G,3,1,,,"2026-01-22 07:21:56","2026-01-22 07:21:56",
2097,6,AUTO-001032,"Bankura Sammilani Medical College, Bankura",,0,G,3,1,,,"2026-01-22 07:21:56","2026-01-22 07:21:56",
2098,6,AUTO-001033,Barasat Government Medical College and Hospital,,0,G,3,1,,,"2026-01-22 07:21:56","2026-01-22 07:21:56",
2099,6,AUTO-001034,"Burdwan Medical College, Burdwan",,0,G,3,1,,,"2026-01-22 07:21:56","2026-01-22 07:21:56",
2100,6,AUTO-001035,"Calcutta National Medical College, Kolkata",,0,G,3,1,,,"2026-01-22 07:21:56","2026-01-22 07:21:56",
2101,6,AUTO-001036,"College of Medicine and JNM Hospital,Kalyani,Nadia",,0,G,3,1,,,"2026-01-22 07:21:56","2026-01-22 07:21:56",
2102,6,AUTO-001037,"College of Medicine and Sagore Dutta Hospital, Kolkata",,0,G,3,1,,,"2026-01-22 07:21:56","2026-01-22 07:21:56",
2103,6,AUTO-001038,"Coochbehar Government Medical College and Hospital, Coochbehar, WB",,0,G,3,1,,,"2026-01-22 07:21:56","2026-01-22 07:21:56",
2104,6,AUTO-001039,"Diamond Harbour Government Medical College and Hospital, West Bengal",,0,G,3,1,,,"2026-01-22 07:21:56","2026-01-22 07:21:56",
2105,6,AUTO-001040,East West Institute of Medical Sciences and Research,,0,P,3,1,,,"2026-01-22 07:21:56","2026-01-22 07:21:56",
2106,6,AUTO-001041,"Employees State Insurance Corporation Medical College, Joka, Kolkata",,0,G,3,1,,,"2026-01-22 07:21:56","2026-01-22 07:21:56",
2107,6,AUTO-001042,"Gouri Devi Institute of Medical Sciences and Hospital, Durgapur",,0,S,3,1,,,"2026-01-22 07:21:56","2026-01-22 07:21:56",
2108,6,AUTO-001043,"Govt. Medical College, Kolkata",,0,G,3,1,,,"2026-01-22 07:21:56","2026-01-22 07:21:56",
2109,6,AUTO-001044,"ICARE Institute of Medical Sciences and Research, Haldia, Purba Midanpore",,0,T,3,1,,,"2026-01-22 07:21:56","2026-01-22 07:21:56",
2110,6,AUTO-001045,"Institute of Postgraduate Medical Education and Research, Kolkata",,0,G,3,1,,,"2026-01-22 07:21:56","2026-01-22 07:21:56",
2111,6,AUTO-001046,"IQ-City Medical College, Burdwan",,0,T,3,1,,,"2026-01-22 07:21:56","2026-01-22 07:21:56",
2112,6,AUTO-001047,"Jagannath Gupta Institute of Medical Sciences and Hospital, Kolkata",,0,T,3,1,,,"2026-01-22 07:21:56","2026-01-22 07:21:56",
2113,6,AUTO-001048,Jalpaiguri Government Medical College,,0,G,3,1,,,"2026-01-22 07:21:56","2026-01-22 07:21:56",
2114,6,AUTO-001049,Jhargram Government Medical College and Hospital,,0,G,3,1,,,"2026-01-22 07:21:56","2026-01-22 07:21:56",
2115,6,AUTO-001050,"JIS School of Medical Science and Research, Howrah",,0,T,3,1,,,"2026-01-22 07:21:56","2026-01-22 07:21:56",
2116,6,AUTO-001051,"JMN Medical College, Nadia",,0,T,3,1,,,"2026-01-22 07:21:56","2026-01-22 07:21:56",
2117,6,AUTO-001052,"KPC Medical College,Jadavpur,Kolkata",,0,T,3,1,,,"2026-01-22 07:21:56","2026-01-22 07:21:56",
2118,6,AUTO-001053,Krishnanagar Institute of Medical Sciences,,0,P,3,1,,,"2026-01-22 07:21:56","2026-01-22 07:21:56",
2119,6,AUTO-001054,"Malda Medical College and Hospital, Malda",,0,G,3,1,,,"2026-01-22 07:21:56","2026-01-22 07:21:56",
2120,6,AUTO-001055,"Midnapore Medical College, Midnapore",,0,G,3,1,,,"2026-01-22 07:21:56","2026-01-22 07:21:56",
2121,6,AUTO-001056,"Murshidabad Medical College and Hospitals, Murshidabad",,0,G,3,1,,,"2026-01-22 07:21:56","2026-01-22 07:21:56",
2122,6,AUTO-001057,"Nilratan Sircar Medical College, Kolkata",,0,G,3,1,,,"2026-01-22 07:21:56","2026-01-22 07:21:56",
2123,6,AUTO-001058,"North Bengal Medical College, Darjeeling",,0,G,3,1,,,"2026-01-22 07:21:56","2026-01-22 07:21:56",
2124,6,AUTO-001059,Prafulla Chandra Sen Government Medical College and Hospital,,0,G,3,1,,,"2026-01-22 07:21:56","2026-01-22 07:21:56",
2125,6,AUTO-001060,Purulia Government Medical College and Hospital,,0,G,3,1,,,"2026-01-22 07:21:56","2026-01-22 07:21:56",
2126,6,AUTO-001061,"Raiganj Government Medical College and Hospital, Raiganj",,0,G,3,1,,,"2026-01-22 07:21:56","2026-01-22 07:21:56",
2127,6,AUTO-001062,"Rampurhat Government Medical College and Hospital, Rampurhat",,0,G,3,1,,,"2026-01-22 07:21:56","2026-01-22 07:21:56",
2128,6,AUTO-001063,"RG Kar Medical College, Kolkata",,0,G,3,1,,,"2026-01-22 07:21:56","2026-01-22 07:21:56",
2129,6,AUTO-001064,"Santiniketan Medical College, Bolpur, West Bengal",,0,T,3,1,,,"2026-01-22 07:21:56","2026-01-22 07:21:56",
2130,6,AUTO-001065,Sarat Chandra Chattopadhyay Government Medical College and Hospital,,0,G,3,1,,,"2026-01-22 07:21:56","2026-01-22 07:21:56",
2131,6,AUTO-001066,"Shri Ramkrishna Institute of Medical Sciences and Sanaka Hospitals, Durgapur",,0,T,3,1,,,"2026-01-22 07:21:56","2026-01-22 07:21:56",
2132,6,AUTO-001067,Tamralipto Government Medical College and Hospital,,0,G,3,1,,,"2026-01-22 07:21:56","2026-01-22 07:21:56",
2133,2,AUTO-001068,"A.B. SHETTY MEMORIAL INSTITUTE OF DENTAL SCIENCES, MANGALORE",,0,P,0,1,,,"2026-01-22 07:21:56","2026-01-22 07:21:56",
2134,2,AUTO-001069,"AIR FORCE INSTITUTE OF DENTAL SCIENCES, BANGALORE",,0,P,0,1,,,"2026-01-22 07:21:56","2026-01-22 07:21:56",
2135,2,AUTO-001070,"DR. SYAMALA REDDY DENTAL COLLEGE, HOSPITAL AND RESEARCH CENTRE, BANGALORE",,0,P,0,1,,,"2026-01-22 07:21:56","2026-01-22 07:21:56",
2136,2,AUTO-001071,"JSS DENTAL COLLEGE AND HOSPITAL, MYSORE",,0,P,0,1,,,"2026-01-22 07:21:56","2026-01-22 07:21:56",
2137,2,AUTO-001072,"KLE VISHWANATH KATTI INSTITUTE OF DENTAL SCIENCES, BELGAUM",,0,P,0,1,,,"2026-01-22 07:21:56","2026-01-22 07:21:56",
2138,2,AUTO-001073,"M.S. RAMAIAH DENTAL COLLEGE, BANGALORE",,0,P,0,1,,,"2026-01-22 07:21:56","2026-01-22 07:21:56",
2139,2,AUTO-001074,"MANIPAL COLLEGE OF DENTAL SCIENCES, MANGALORE",,0,P,0,1,,,"2026-01-22 07:21:56","2026-01-22 07:21:56",
2140,2,AUTO-001075,"MANIPAL COLLEGE OF DENTAL SCIENCES, MANIPAL",,0,P,0,1,,,"2026-01-22 07:21:56","2026-01-22 07:21:56",
2141,2,AUTO-001076,"SDM COLLEGE OF DENTAL SCIENCES AND HOSPITAL, DHARWAD",,0,P,0,1,,,"2026-01-22 07:21:56","2026-01-22 07:21:56",
2142,2,AUTO-001077,"SRI SIDDHARTHA DENTAL COLLEGE, TUMKUR",,0,P,0,1,,,"2026-01-22 07:21:56","2026-01-22 07:21:56",
2143,2,AUTO-001078,"YENEPOYA DENTAL COLLEGE AND HOSPITAL, MANGALORE",,0,P,0,1,,,"2026-01-22 07:21:56","2026-01-22 07:21:56",
2144,2,AUTO-001079,"Anil Neerukonda Institute of Dental Sciences, Visakhapatnam",,0,P,0,1,,,"2026-01-22 07:21:56","2026-01-22 07:21:56",
2145,2,AUTO-001080,"C.K.S. Teja Institute of Dental Sciences AND Research, Tirupati",,0,P,0,1,,,"2026-01-22 07:21:56","2026-01-22 07:21:56",
2146,2,AUTO-001081,"Care Dental College, Guntur",,0,P,0,1,,,"2026-01-22 07:21:56","2026-01-22 07:21:56",
2147,2,AUTO-001082,"Drs. Sudha AND Nageswara Rao Siddhartha Institute of Dental Sciences, Gannavaram Mandalam",,0,P,0,1,,,"2026-01-22 07:21:56","2026-01-22 07:21:56",
2148,2,AUTO-001083,"G. Pulla Reddy Dental College AND Hospital, Kurnool",,0,P,0,1,,,"2026-01-22 07:21:56","2026-01-22 07:21:56",
2149,2,AUTO-001084,"Gitam Dental College AND Hospital, Vishakhapatnam",,0,P,0,1,,,"2026-01-22 07:21:56","2026-01-22 07:21:56",
2150,2,AUTO-001085,"Govt. Dental College AND Hospital, Vijayawada",,0,G,0,1,,,"2026-01-22 07:21:56","2026-01-22 07:21:56",
2151,2,AUTO-001086,"Govt. Dental College, RIMS, Kadapa",,0,G,0,1,,,"2026-01-22 07:21:56","2026-01-22 07:21:56",
2152,2,AUTO-001087,"GSL Dental College AND Hospital, Rajahmundry",,0,P,0,1,,,"2026-01-22 07:21:56","2026-01-22 07:21:56",
2153,2,AUTO-001088,"KIMS Dental College, Amalapuram",,0,P,0,1,,,"2026-01-22 07:21:56","2026-01-22 07:21:56",
2154,2,AUTO-001089,"Lenora Institute of Dental Sciences, Rajahmundry",,0,P,0,1,,,"2026-01-22 07:21:56","2026-01-22 07:21:56",
2155,2,AUTO-001090,"Narayana Dental College AND Hospital, Nellore",,0,P,0,1,,,"2026-01-22 07:21:56","2026-01-22 07:21:56",
2156,2,AUTO-001091,Nimra Institute of Dental Sciences,,0,P,0,1,,,"2026-01-22 07:21:56","2026-01-22 07:21:56",
2157,2,AUTO-001092,"Sibar Institute of Dental Sciences, Guntur",,0,P,0,1,,,"2026-01-22 07:21:56","2026-01-22 07:21:56",
2158,2,AUTO-001093,"Sree Sai Dental College AND Research Institute, Srikakulam",,0,P,0,1,,,"2026-01-22 07:21:56","2026-01-22 07:21:56",
2159,2,AUTO-001094,"St. Joseph Dental College, Duggirala",,0,P,0,1,,,"2026-01-22 07:21:56","2026-01-22 07:21:56",
2160,2,AUTO-001095,"Vishnu Dental College, Bhimavaram",,0,P,0,1,,,"2026-01-22 07:21:56","2026-01-22 07:21:56",
2161,2,AUTO-001096,"Govt. Dental College, Dibrugarh, Assam",,0,G,0,1,,,"2026-01-22 07:21:56","2026-01-22 07:21:56",
2162,2,AUTO-001097,"Govt. Dental College, Silchar, Assam",,0,G,0,1,,,"2026-01-22 07:21:56","2026-01-22 07:21:56",
2163,2,AUTO-001098,"Regional Dental College, Guwahati",,0,G,0,1,,,"2026-01-22 07:21:56","2026-01-22 07:21:56",
2164,2,AUTO-001099,"Buddha Institute of Dental Sciences AND Hospital, Kankarbagh, Patna",,0,P,0,1,,,"2026-01-22 07:21:56","2026-01-22 07:21:56",
2165,2,AUTO-001100,"Dr. B.R. Ambedkar Institute of Dental Sciences AND Hospital, Patna",,0,P,0,1,,,"2026-01-22 07:21:56","2026-01-22 07:21:56",
2166,2,AUTO-001101,"Government Dental College AND Hospital, Nalanda",,0,G,0,1,,,"2026-01-22 07:21:56","2026-01-22 07:21:56",
2167,2,AUTO-001102,"Mithila Minority Dental College AND Hospital, Darbhanga",,0,P,0,1,,,"2026-01-22 07:21:56","2026-01-22 07:21:56",
2168,2,AUTO-001103,"Patna Dental College AND Hospital, Patna",,0,G,0,1,,,"2026-01-22 07:21:56","2026-01-22 07:21:56",
2169,2,AUTO-001104,"Sarjug Dental College, Darbhanga",,0,P,0,1,,,"2026-01-22 07:21:56","2026-01-22 07:21:56",
2170,2,AUTO-001105,"Dr. Harvansh Singh Judge Institute of Dental Sciences AND Hospital, Chandigarh",,0,G,0,1,,,"2026-01-22 07:21:56","2026-01-22 07:21:56",
2171,2,AUTO-001106,"Chattisgarh Dental College AND Research Institute, Rajnandgaon",,0,P,0,1,,,"2026-01-22 07:21:56","2026-01-22 07:21:56",
2172,2,AUTO-001107,"Govt. Dental College, Raipur, Chhattisgarh",,0,G,0,1,,,"2026-01-22 07:21:56","2026-01-22 07:21:56",
2173,2,AUTO-001108,"Maitri College of Dentistry and Research Centre, Durg",,0,P,0,1,,,"2026-01-22 07:21:56","2026-01-22 07:21:56",
2174,2,AUTO-001109,"New Horizon Dental College AND Research Instiute, Bilaspur",,0,P,0,1,,,"2026-01-22 07:21:56","2026-01-22 07:21:56",
2175,2,AUTO-001110,"Rungta College of Dental Sciences AND Research, Bhilai",,0,P,0,1,,,"2026-01-22 07:21:56","2026-01-22 07:21:56",
2176,2,AUTO-001111,"Triveni Institute of Dental Sciences, Hosptial AND Research Centre, Bilaspur",,0,P,0,1,,,"2026-01-22 07:21:56","2026-01-22 07:21:56",
2177,2,AUTO-001112,"Vaidik Dental College and Research Centre,",,0,P,0,1,,,"2026-01-22 07:21:56","2026-01-22 07:21:56",
2178,2,AUTO-001113,"Army Hospital (Research and Referral) Delhi Cantt, Delhi",,0,G,0,1,,,"2026-01-22 07:21:56","2026-01-22 07:21:56",
2179,2,AUTO-001114,"ESIC Dental College, Rohini, New Delhi",,0,G,0,1,,,"2026-01-22 07:21:56","2026-01-22 07:21:56",
2180,2,AUTO-001115,"Faculty of Dentistry, Jamia Millia Islamia, New Delhi",,0,G,0,1,,,"2026-01-22 07:21:56","2026-01-22 07:21:56",
2181,2,AUTO-001116,Lady Hardinge Medical College AND Smt. Sucheta Kriplani Hospital New Delhi,,0,G,0,1,,,"2026-01-22 07:21:56","2026-01-22 07:21:56",
2182,2,AUTO-001117,"Maulana Azad Dental College AND Hospital, New Delhi",,0,G,0,1,,,"2026-01-22 07:21:56","2026-01-22 07:21:56",
2183,2,AUTO-001118,"University College of Medical Sciences, Dilshad Garden",,0,G,0,1,,,"2026-01-22 07:21:56","2026-01-22 07:21:56",
2184,2,AUTO-001119,"Goa Dental College AND Hospital, Goa",,0,G,0,1,,,"2026-01-22 07:21:56","2026-01-22 07:21:56",
2185,2,AUTO-001120,"Ahmedabad Dental College AND Hospital, Gandhinagar",,0,P,0,1,,,"2026-01-22 07:21:56","2026-01-22 07:21:56",
2186,2,AUTO-001121,"AMC Dental College, Ahmedabad",,0,G,0,1,,,"2026-01-22 07:21:56","2026-01-22 07:21:56",
2187,2,AUTO-001122,"College of Dental Sciences and Research Centre, Ahmedabad",,0,P,0,1,,,"2026-01-22 07:21:56","2026-01-22 07:21:56",
2188,2,AUTO-001123,"College of Dental Sciences, Amargadh",,0,P,0,1,,,"2026-01-22 07:21:56","2026-01-22 07:21:56",
2189,2,AUTO-001124,"Faculty of Dental Science, Dharmsinh Desai University, Nadiad",,0,P,0,1,,,"2026-01-22 07:21:56","2026-01-22 07:21:56",
2190,2,AUTO-001125,"Goenka Research Institute of Dental Sciences, Gandhinagar",,0,P,0,1,,,"2026-01-22 07:21:56","2026-01-22 07:21:56",
2191,2,AUTO-001126,"Govt. Dental College AND Hospital, Ahmedabad",,0,G,0,1,,,"2026-01-22 07:21:56","2026-01-22 07:21:56",
2192,2,AUTO-001127,"Govt. Dental College Hospital, Jamnagar",,0,G,0,1,,,"2026-01-22 07:21:56","2026-01-22 07:21:56",
2193,2,AUTO-001128,"K.M. Shah Dental College AND Hospital, Vadodara",,0,P,0,1,,,"2026-01-22 07:21:56","2026-01-22 07:21:56",
2194,2,AUTO-001129,"Karnavati School of Dentistry, Gandhinagar",,0,P,0,1,,,"2026-01-22 07:21:56","2026-01-22 07:21:56",
2195,2,AUTO-001130,"Manubhai Patel Dental College AND Dental Hospital AND SSR General Hospital, Vadodara",,0,P,0,1,,,"2026-01-22 07:21:56","2026-01-22 07:21:56",
2196,2,AUTO-001131,"Narsinhbhai Patel Dental College AND Hospital, Visnagar",,0,P,0,1,,,"2026-01-22 07:21:56","2026-01-22 07:21:56",
2197,2,AUTO-001132,"Siddhpur Dental College, Patan",,0,G,0,1,,,"2026-01-22 07:21:56","2026-01-22 07:21:56",
2198,2,AUTO-001133,"D.A.V. Centenary Dental College, Yamuna nagar",,0,P,0,1,,,"2026-01-22 07:21:56","2026-01-22 07:21:56",
2199,2,AUTO-001134,"Jan Nayak Ch. Devi Lal Dental College, Sirsa",,0,P,0,1,,,"2026-01-22 07:21:56","2026-01-22 07:21:56",
2200,2,AUTO-001135,"Maharishi Markandeshwar College of Dental Sciences AND Research, Mullana",,0,P,0,1,,,"2026-01-22 07:21:56","2026-01-22 07:21:56",
2201,2,AUTO-001136,"Manav Rachana Dental College, Faridabad",,0,P,0,1,,,"2026-01-22 07:21:56","2026-01-22 07:21:56",
2202,2,AUTO-001137,"PDM Dental College AND Research Institute, Jhajjar",,0,P,0,1,,,"2026-01-22 07:21:56","2026-01-22 07:21:56",
2203,2,AUTO-001138,"Post Graduate Institute of Dental Sciences, Rohtak",,0,G,0,1,,,"2026-01-22 07:21:56","2026-01-22 07:21:56",
2204,2,AUTO-001139,"Sri Govind Tricentenary Dental College, Hospital AND Research Institute",,0,P,0,1,,,"2026-01-22 07:21:56","2026-01-22 07:21:56",
2205,2,AUTO-001140,"Sudha Rustagi College of Dental Sciences AND Research,Faridabad",,0,P,0,1,,,"2026-01-22 07:21:56","2026-01-22 07:21:56",
2206,2,AUTO-001141,"Swami Devi Dyal Hospital AND Dental College, Panchkula",,0,P,0,1,,,"2026-01-22 07:21:56","2026-01-22 07:21:56",
2207,2,AUTO-001142,"Yamuna Institute of Dental Sciences AND Research, Yamuna Nagar",,0,P,0,1,,,"2026-01-22 07:21:56","2026-01-22 07:21:56",
2208,2,AUTO-001143,"Bhojia Dental College AND Hospital, Nalagarh",,0,P,0,1,,,"2026-01-22 07:21:56","2026-01-22 07:21:56",
2209,2,AUTO-001144,"H.P. Govt. Dental College AND Hospital, Shimla",,0,G,0,1,,,"2026-01-22 07:21:56","2026-01-22 07:21:56",
2210,2,AUTO-001145,"Himachal Dental College, Sunder Nagar",,0,P,0,1,,,"2026-01-22 07:21:56","2026-01-22 07:21:56",
2211,2,AUTO-001146,"Himachal Institute of Dental Sciences, Poanta Sahib",,0,P,0,1,,,"2026-01-22 07:21:56","2026-01-22 07:21:56",
2212,2,AUTO-001147,"M.N.D.A.V. Dental College AND Hospital, Solan",,0,P,0,1,,,"2026-01-22 07:21:56","2026-01-22 07:21:56",
2213,2,AUTO-001148,"Govt. Dental College, Srinagar",,0,G,0,1,,,"2026-01-22 07:21:56","2026-01-22 07:21:56",
2214,2,AUTO-001149,"Indira Gandhi Government Dental College, Jammu",,0,G,0,1,,,"2026-01-22 07:21:56","2026-01-22 07:21:56",
2215,2,AUTO-001150,"Institute of Dental Sciences, Sehora",,0,P,0,1,,,"2026-01-22 07:21:56","2026-01-22 07:21:56",
2216,2,AUTO-001151,"Awadh Dental College AND Hospital, Jamshedpur",,0,P,0,1,,,"2026-01-22 07:21:56","2026-01-22 07:21:56",
2217,2,AUTO-001152,"Dental Institute Rajendra Institute of Medical Sciences, Ranchi",,0,G,0,1,,,"2026-01-22 07:21:56","2026-01-22 07:21:56",
2218,2,AUTO-001153,"Hazaribag College of Dental Sciences and Hospital, Hazaribag",,0,P,0,1,,,"2026-01-22 07:21:56","2026-01-22 07:21:56",
2219,2,AUTO-001154,"Vananchal Dental College AND Hospital, Garhwa",,0,P,0,1,,,"2026-01-22 07:21:56","2026-01-22 07:21:56",
2220,2,AUTO-001155,"Al-Azhar Dental College, Kerala",,0,P,0,1,,,"2026-01-22 07:21:56","2026-01-22 07:21:56",
2221,2,AUTO-001156,"Amrita School of Dentistry, Kochi",,0,P,0,1,,,"2026-01-22 07:21:56","2026-01-22 07:21:56",
2222,2,AUTO-001157,"Annoor Dental College AND Hospital, Ernakulam",,0,P,0,1,,,"2026-01-22 07:21:56","2026-01-22 07:21:56",
2223,2,AUTO-001158,"Azeezia College of Dental Sciences AND Research, Kollam",,0,P,0,1,,,"2026-01-22 07:21:56","2026-01-22 07:21:56",
2224,2,AUTO-001159,"Century International Institute of Dental Science AND Research Center, Kasaragod",,0,P,0,1,,,"2026-01-22 07:21:56","2026-01-22 07:21:56",
2225,2,AUTO-001160,"Educare Institute of Dental Sciences, Malappuram",,0,P,0,1,,,"2026-01-22 07:21:56","2026-01-22 07:21:56",
2226,2,AUTO-001161,"Govt. Dental College, Alappuzha",,0,G,0,1,,,"2026-01-22 07:21:56","2026-01-22 07:21:56",
2227,2,AUTO-001162,"Govt. Dental College, Kottayam",,0,G,0,1,,,"2026-01-22 07:21:56","2026-01-22 07:21:56",
2228,2,AUTO-001163,"Govt. Dental College, Kozhikode",,0,G,0,1,,,"2026-01-22 07:21:56","2026-01-22 07:21:56",
2229,2,AUTO-001164,"Govt. Dental College, Thrissur",,0,G,0,1,,,"2026-01-22 07:21:56","2026-01-22 07:21:56",
2230,2,AUTO-001165,"Govt. Dental College, Trivandrum",,0,G,0,1,,,"2026-01-22 07:21:56","2026-01-22 07:21:56",
2231,2,AUTO-001166,"Indira Gandhi Institute of Dental Sciences, Kothamangalam",,0,P,0,1,,,"2026-01-22 07:21:56","2026-01-22 07:21:56",
2232,2,AUTO-001167,"Kannur Dental College, kannur",,0,P,0,1,,,"2026-01-22 07:21:56","2026-01-22 07:21:56",
2233,2,AUTO-001168,"KMCT Dental College, Calicut",,0,P,0,1,,,"2026-01-22 07:21:56","2026-01-22 07:21:56",
2234,2,AUTO-001169,"Malabar Dental College AND Research Centre, Malappuram",,0,P,0,1,,,"2026-01-22 07:21:56","2026-01-22 07:21:56",
2235,2,AUTO-001170,"Mar Baselios Dental College, Kothamangalam",,0,P,0,1,,,"2026-01-22 07:21:56","2026-01-22 07:21:56",
2236,2,AUTO-001171,"MES Dental College, Malappuram",,0,P,0,1,,,"2026-01-22 07:21:56","2026-01-22 07:21:56",
2237,2,AUTO-001172,"Noorul Islam College of Dental Sciences, Trivandrum",,0,P,0,1,,,"2026-01-22 07:21:56","2026-01-22 07:21:56",
2238,2,AUTO-001173,"Pariyaram Dental College, Academy of Medical Sciences, Kannur",,0,G,0,1,,,"2026-01-22 07:21:56","2026-01-22 07:21:56",
2239,2,AUTO-001174,"PMS College of Dental Science AND Research, Thiruvananthpuram",,0,P,0,1,,,"2026-01-22 07:21:56","2026-01-22 07:21:56",
2240,2,AUTO-001175,"PSM College of Dental Sciences AND Research, Trichur",,0,P,0,1,,,"2026-01-22 07:21:56","2026-01-22 07:21:56",
2241,2,AUTO-001176,"Pushpagiri College of Dental Sciences, Tiruvalla",,0,P,0,1,,,"2026-01-22 07:21:56","2026-01-22 07:21:56",
2242,2,AUTO-001177,"Royal Dental College, kerala",,0,P,0,1,,,"2026-01-22 07:21:56","2026-01-22 07:21:56",
2243,2,AUTO-001178,"Sree Anjaneya Medical Trust, Calicut",,0,P,0,1,,,"2026-01-22 07:21:56","2026-01-22 07:21:56",
2244,2,AUTO-001179,"Sri Sankara Dental College, Thiruvananthapuram",,0,P,0,1,,,"2026-01-22 07:21:56","2026-01-22 07:21:56",
2245,2,AUTO-001180,"St. Gregorios Dental College, Ernakulam",,0,P,0,1,,,"2026-01-22 07:21:56","2026-01-22 07:21:56",
2246,2,AUTO-001181,Travancore Dental College,,0,P,0,1,,,"2026-01-22 07:21:56","2026-01-22 07:21:56",
2247,2,AUTO-001182,"Bhabha College of Dental Sciences, Bhopal",,0,P,0,1,,,"2026-01-22 07:21:56","2026-01-22 07:21:56",
2248,2,AUTO-001183,"College of Dental Sciences AND Hospital, Indore",,0,P,0,1,,,"2026-01-22 07:21:56","2026-01-22 07:21:56",
2249,2,AUTO-001184,College of Dentistry- Indore,,0,G,0,1,,,"2026-01-22 07:21:56","2026-01-22 07:21:56",
2250,2,AUTO-001185,"Guru Gobind Singh College of Dental Science AND Research Centre, Burhanpur",,0,P,0,1,,,"2026-01-22 07:21:56","2026-01-22 07:21:56",
2251,2,AUTO-001186,"Hitkarini Dental College AND Hospital, Jabalpur",,0,P,0,1,,,"2026-01-22 07:21:56","2026-01-22 07:21:56",
2252,2,AUTO-001187,"Index Institute of Dental Sciences, Indore",,0,P,0,1,,,"2026-01-22 07:21:56","2026-01-22 07:21:56",
2253,2,AUTO-001188,"Institute of Dental Education AND Advance Studies (IDEAS), Gwalior",,0,P,0,1,,,"2026-01-22 07:21:56","2026-01-22 07:21:56",
2254,2,AUTO-001189,"Maharana Pratap College of Dentistry AND Research Centre, Gwalior",,0,P,0,1,,,"2026-01-22 07:21:56","2026-01-22 07:21:56",
2255,2,AUTO-001190,"Mansarover Dental College, Bhopal",,0,P,0,1,,,"2026-01-22 07:21:56","2026-01-22 07:21:56",
