"id","mas_college_stream_id","mas_college_code","mas_college_name","mas_college_canonical_college_id","mas_college_exam_centre","mas_college_type","mas_college_is_internal","mas_college_status_id","created_by","updated_by","created_at","updated_at","deleted_at"
705,7,N468,CIMS COLLEGE OF NURSING,,0,P,0,1,,,"2026-01-22 07:21:55","2026-01-22 07:21:55",
706,7,N036,CITY COLLEGE OF NURSING,,0,P,0,1,,,"2026-01-22 07:21:55","2026-01-22 07:21:55",
707,7,N131,CNK COLLEGE OF NURSING,,0,P,0,1,,,"2026-01-22 07:21:55","2026-01-22 07:21:55",
708,7,N261,KIMS COLLEGE OF NURSING,,0,P,0,1,,,"2026-01-22 07:21:55","2026-01-22 07:21:55",
709,7,N027,ST. MARTHA'S HOSPITAL COLLEGE OF NURSING-,,0,P,0,1,,,"2026-01-22 07:21:55","2026-01-22 07:21:55",
710,7,N203,COLUMBIA COLLEGE OF NURSING,,0,P,0,1,,,"2026-01-22 07:21:55","2026-01-22 07:21:55",
711,7,N371,COMMAND HOSPITAL COLLEGE OF NURSING,,0,P,0,1,,,"2026-01-22 07:21:55","2026-01-22 07:21:55",
712,7,N474,CRESCENT COLLEGE OF NURSING,,0,P,0,1,,,"2026-01-22 07:21:55","2026-01-22 07:21:55",
713,7,N395,CSI LOMBARD MEMORIAL COLLEGE OF NURSING,,0,P,0,1,,,"2026-01-22 07:21:55","2026-01-22 07:21:55",
714,7,N577,CURA COLLEGE OF NURSING,,0,P,0,1,,,"2026-01-22 07:21:55","2026-01-22 07:21:55",
715,7,N390,D.M.J. INSTITUTE OF NURSING,,0,P,0,1,,,"2026-01-22 07:21:55","2026-01-22 07:21:55",
716,7,N451,DECCAN COLLEGE OF NURSING,,0,P,0,1,,,"2026-01-22 07:21:55","2026-01-22 07:21:55",
717,7,N618,DEVARAJA COLLEGE OF NURSING,,0,P,0,1,,,"2026-01-22 07:21:55","2026-01-22 07:21:55",
718,7,N377,DHANUSH INSTITUTE OF NURSING SCIENCES,,0,P,0,1,,,"2026-01-22 07:21:55","2026-01-22 07:21:55",
719,7,NF122,DHANWANTARI NURSING COLLEGE,,0,P,0,1,,,"2026-01-22 07:21:55","2026-01-22 07:21:55",
720,7,N374,DIMHANS COLLEGE OF NURSING,,0,P,0,1,,,"2026-01-22 07:21:55","2026-01-22 07:21:55",
721,7,N091,DIANA COLLEGE OF NURSING,,0,P,0,1,,,"2026-01-22 07:21:55","2026-01-22 07:21:55",
722,7,N530,DIPALI NURSING COLLEGE,,0,P,0,1,,,"2026-01-22 07:21:55","2026-01-22 07:21:55",
723,7,N379,DIVINE GRACE COLLEGE OF NURSING,,0,P,0,1,,,"2026-01-22 07:21:55","2026-01-22 07:21:55",
724,7,N466,DIVINE INSTITUTE OF NURSING SCIENCES,,0,P,0,1,,,"2026-01-22 07:21:55","2026-01-22 07:21:55",
725,7,N285,DIYA COLLEGE OF NURSING,,0,P,0,1,,,"2026-01-22 07:21:55","2026-01-22 07:21:55",
726,7,N345,DR. B.R. AMBEDKAR INSTITUTE OF NURSING,,0,P,0,1,,,"2026-01-22 07:21:55","2026-01-22 07:21:55",
727,7,NF139,DR. JOHN'S COLLEGE OF NURSING,,0,P,0,1,,,"2026-01-22 07:21:55","2026-01-22 07:21:55",
728,7,N362,DR. LALITHA MONOHARAN COLLEGE OF NURSING,,0,P,0,1,,,"2026-01-22 07:21:55","2026-01-22 07:21:55",
729,7,N121,DR. LYDIA COLACO COLLEGE OF NURSING,,0,P,0,1,,,"2026-01-22 07:21:55","2026-01-22 07:21:55",
730,7,N015,DR. M V SHETTY COLLEGE OF NURSING,,0,P,0,1,,,"2026-01-22 07:21:55","2026-01-22 07:21:55",
731,7,N501,HKES COLLEGE OF NURSING,,0,P,0,1,,,"2026-01-22 07:21:55","2026-01-22 07:21:55",
732,7,N055,DR. SHYAMALA REDDY COLLEGE OF NURSING,,0,P,0,1,,,"2026-01-22 07:21:55","2026-01-22 07:21:55",
733,7,NF157,E T C M COLLEGE OF NURSING,,0,P,0,1,,,"2026-01-22 07:21:55","2026-01-22 07:21:55",
734,7,N129,EAST POINT COLLEGE OF NURSING,,0,P,0,1,,,"2026-01-22 07:21:55","2026-01-22 07:21:55",
735,7,N028,EAST WEST COLLEGE OF NURSING,,0,P,0,1,,,"2026-01-22 07:21:55","2026-01-22 07:21:55",
736,7,N086,EBEN EZER COLLEGE OF NURSING,,0,P,0,1,,,"2026-01-22 07:21:55","2026-01-22 07:21:55",
737,7,N376,"ESIC COLLEGE OF NURSING, KALBURGI",,0,P,0,1,,,"2026-01-22 07:21:55","2026-01-22 07:21:55",
738,7,N370,ESIC HOSPITAL COLLEGE OF NURSING,,0,P,0,1,,,"2026-01-22 07:21:55","2026-01-22 07:21:55",
739,7,NF110,ESS VEE COLLEGE OF NURSING,,0,P,0,1,,,"2026-01-22 07:21:55","2026-01-22 07:21:55",
740,7,N568,EXCELLENT COLLEGE OF NURSING,,0,P,0,1,,,"2026-01-22 07:21:55","2026-01-22 07:21:55",
741,7,N297,FAITH COLLEGE OF NURSING SCIENCES,,0,P,0,1,,,"2026-01-22 07:21:55","2026-01-22 07:21:55",
742,7,N253,FAITH INSTITUTE OF NURSING SCIENCES,,0,P,0,1,,,"2026-01-22 07:21:55","2026-01-22 07:21:55",
743,7,N008,FARAN COLLEGE OF NURSING,,0,P,0,1,,,"2026-01-22 07:21:55","2026-01-22 07:21:55",
744,7,N270,FATHER MATHEWS COLLEGE OF NURSING,,0,P,0,1,,,"2026-01-22 07:21:55","2026-01-22 07:21:55",
745,7,N565,FATHER MULLER NURSING COLLEGE,,0,P,0,1,,,"2026-01-22 07:21:55","2026-01-22 07:21:55",
746,7,N249,FEDERAL COLLEGE OF NURSING,,0,P,0,1,,,"2026-01-22 07:21:55","2026-01-22 07:21:55",
747,7,N007,FLORENCE COLLEGE OF NURSING,,0,P,0,1,,,"2026-01-22 07:21:55","2026-01-22 07:21:55",
748,7,N062,FLORIDA COLLEGE OF NURSING,,0,P,0,1,,,"2026-01-22 07:21:55","2026-01-22 07:21:55",
749,7,N494,FORTUNE COLLEGE OF NURSING,,0,P,0,1,,,"2026-01-22 07:21:55","2026-01-22 07:21:55",
750,7,N011,FR. MULLER'S COLLEGE OF NURSING,,0,P,0,1,,,"2026-01-22 07:21:55","2026-01-22 07:21:55",
751,7,N302,G B COLLEGE OF NURSING,,0,P,0,1,,,"2026-01-22 07:21:55","2026-01-22 07:21:55",
752,7,N306,G R R COLLEGE OF NURSING,,0,P,0,1,,,"2026-01-22 07:21:55","2026-01-22 07:21:55",
753,7,N279,G.J. SURYA COLLEGE OF NURSING,,0,P,0,1,,,"2026-01-22 07:21:55","2026-01-22 07:21:55",
754,7,N116,GANGOTHRI COLLEGE OF NURSING,,0,P,0,1,,,"2026-01-22 07:21:55","2026-01-22 07:21:55",
755,7,N078,GAYATHRI COLLEGE OF NURSING,,0,P,0,1,,,"2026-01-22 07:21:55","2026-01-22 07:21:55",
756,7,NF124,GAYATHRI DEVI COLLEGE OF NURSING,,0,P,0,1,,,"2026-01-22 07:21:55","2026-01-22 07:21:55",
757,7,N382,GIMS GOVERNMENT COLLEGE OF  NURSING,,0,G,0,1,,,"2026-01-22 07:21:55","2026-01-22 07:21:55",
758,7,N072,GLOBAL COLLEGE OF NURSING,,0,P,0,1,,,"2026-01-22 07:21:55","2026-01-22 07:21:55",
759,7,N509,GNYANA GANGA COLLEGE OF NURSING,,0,P,0,1,,,"2026-01-22 07:21:55","2026-01-22 07:21:55",
760,7,N547,GNYANA SUDHA COLLEGE OF NURSING,,0,P,0,1,,,"2026-01-22 07:21:55","2026-01-22 07:21:55",
761,7,N211,GOLD FINCH COLLEGE OF NURSING,,0,P,0,1,,,"2026-01-22 07:21:55","2026-01-22 07:21:55",
762,7,N288,GOLDEN INSTITUTE OF NURSING SCIENCES,,0,P,0,1,,,"2026-01-22 07:21:55","2026-01-22 07:21:55",
763,7,N061,GOPALA GOWDA SHANTAVERI MEMORIAL COLLEGE OF NURSING,,0,P,0,1,,,"2026-01-22 07:21:55","2026-01-22 07:21:55",
764,7,N583,GOURAMMA INSTITUTE OF NURSING SCIENCES,,0,P,0,1,,,"2026-01-22 07:21:55","2026-01-22 07:21:55",
765,7,NF171,GOUTHAM COLLEGE  OF NURSING,,0,P,0,1,,,"2026-01-22 07:21:55","2026-01-22 07:21:55",
766,7,N044,GOUTHAM COLLEGE OF NURSING,,0,P,0,1,,,"2026-01-22 07:21:55","2026-01-22 07:21:55",
767,7,NF174,GOUTHAMI COLLEGE OF NURSING,,0,P,0,1,,,"2026-01-22 07:21:55","2026-01-22 07:21:55",
768,7,N517,"GOVERNMENT  COLLEGE  OF  NURSING, CHITRADURGA",,0,G,0,1,,,"2026-01-22 07:21:55","2026-01-22 07:21:55",
769,7,N429,"GOVERNMENT  COLLEGE  OF  NURSING, VIJAYAPUR",,0,G,0,1,,,"2026-01-22 07:21:55","2026-01-22 07:21:55",
770,7,N438,"GOVERNMENT  COLLEGE  OF NURSING, TUMKUR",,0,G,0,1,,,"2026-01-22 07:21:55","2026-01-22 07:21:55",
771,7,N001,"GOVERNMENT  COLLEGE OF NURSING, BENGALURU",,0,G,0,1,,,"2026-01-22 07:21:55","2026-01-22 07:21:55",
772,7,NF292,"GOVERNMENT COLLEGE  OF  NURSING, GULBARGA",,0,G,0,1,,,"2026-01-22 07:21:55","2026-01-22 07:21:55",
773,7,NF285,"GOVERNMENT COLLEGE  OF NURSING, HOLENARASIPURA",,0,G,0,1,,,"2026-01-22 07:21:55","2026-01-22 07:21:55",
774,7,NF284,"GOVERNMENT COLLEGE OF  NURSING, HASSAN",,0,G,0,1,,,"2026-01-22 07:21:55","2026-01-22 07:21:55",
775,7,N549,"GOVERNMENT COLLEGE OF  NURSING, HAVERI",,0,G,0,1,,,"2026-01-22 07:21:55","2026-01-22 07:21:55",
776,7,N516,"GOVERNMENT COLLEGE OF NURSING, KARKALA",,0,G,0,1,,,"2026-01-22 07:21:55","2026-01-22 07:21:55",
777,7,N480,GRAND COLLEGE OF NURSING,,0,P,0,1,,,"2026-01-22 07:21:55","2026-01-22 07:21:55",
778,7,NF097,GREEN CITY COLLEGE OF NURSING,,0,P,0,1,,,"2026-01-22 07:21:55","2026-01-22 07:21:55",
779,7,N601,GRV COLLEGE OF NURSING,,0,P,0,1,,,"2026-01-22 07:21:55","2026-01-22 07:21:55",
780,7,N495,GURAMMA COLLEGE OF NURSING,,0,P,0,1,,,"2026-01-22 07:21:55","2026-01-22 07:21:55",
781,7,N593,GURUDEV COLLEGE OF NURSING,,0,P,0,1,,,"2026-01-22 07:21:55","2026-01-22 07:21:55",
782,7,N068,H D DEVEGOWDA CO - OPERATIVE COLLEGE OF NURSING,,0,P,0,1,,,"2026-01-22 07:21:55","2026-01-22 07:21:55",
783,7,N406,H P R COLLEGE OF NURSING,,0,P,0,1,,,"2026-01-22 07:21:55","2026-01-22 07:21:55",
784,7,N421,H. K. COLLEGE OF NURSING,,0,P,0,1,,,"2026-01-22 07:21:55","2026-01-22 07:21:55",
785,7,N564,H.T.  SASNUR INSTITUTE OF NURSING SCIENCES,,0,P,0,1,,,"2026-01-22 07:21:55","2026-01-22 07:21:55",
786,7,N473,HALAMMA COLLEGE OF NURSING,,0,P,0,1,,,"2026-01-22 07:21:55","2026-01-22 07:21:55",
787,7,N269,HARSHA COLLEGE OF NURSING,,0,P,0,1,,,"2026-01-22 07:21:55","2026-01-22 07:21:55",
788,7,N546,HASS INSTITUTE OF NURSING SCIENCES,,0,P,0,1,,,"2026-01-22 07:21:55","2026-01-22 07:21:55",
789,7,NF107,HEARTLAND COLLEGE OF NURSING,,0,P,0,1,,,"2026-01-22 07:21:55","2026-01-22 07:21:55",
790,7,N458,HERITAGE CITY COLLEGE OF NURSING,,0,P,0,1,,,"2026-01-22 07:21:55","2026-01-22 07:21:55",
791,7,N040,HILL SIDE COLLEGE OF NURSING,,0,P,0,1,,,"2026-01-22 07:21:55","2026-01-22 07:21:55",
792,7,N272,HILL VIEW NURSING OF NURSING,,0,P,0,1,,,"2026-01-22 07:21:55","2026-01-22 07:21:55",
793,7,N464,HIMA INSTITUTE OF NURSING SCIENCES,,0,P,0,1,,,"2026-01-22 07:21:55","2026-01-22 07:21:55",
794,7,N177,HINA COLLEGE OF NURSING,,0,P,0,1,,,"2026-01-22 07:21:55","2026-01-22 07:21:55",
795,7,N142,HINDUSTAN COLLEGE OF NURSING,,0,P,0,1,,,"2026-01-22 07:21:55","2026-01-22 07:21:55",
796,7,N465,HITA COLLEGE OF NURSING,,0,P,0,1,,,"2026-01-22 07:21:55","2026-01-22 07:21:55",
797,7,N295,HI-TECH CITY COLLEGE OF NURSING,,0,P,0,1,,,"2026-01-22 07:21:55","2026-01-22 07:21:55",
798,7,N109,HOLDSWORTH MEMORIAL COLLEGE OF NURSING,,0,P,0,1,,,"2026-01-22 07:21:55","2026-01-22 07:21:55",
799,7,N446,HOLY CROSS COLLEGE OF NURSING,,0,P,0,1,,,"2026-01-22 07:21:55","2026-01-22 07:21:55",
800,7,N512,HOPKINS COLLEGE OF NURSING,,0,P,0,1,,,"2026-01-22 07:21:55","2026-01-22 07:21:55",
801,7,N351,HOSKOTE MISSION INSTITUTE OF NURSING,,0,P,0,1,,,"2026-01-22 07:21:55","2026-01-22 07:21:55",
802,7,N119,HOSMAT COLLEGE OF NURSING,,0,P,0,1,,,"2026-01-22 07:21:55","2026-01-22 07:21:55",
803,7,N424,HPR COLLEGE OF NURSING,,0,P,0,1,,,"2026-01-22 07:21:55","2026-01-22 07:21:55",
804,7,NF113,IKON NURSING COLLEGE,,0,P,0,1,,,"2026-01-22 07:21:55","2026-01-22 07:21:55",
805,7,NF136,INDIAN ACADEMY COLLEGE OF NURSING,,0,P,0,1,,,"2026-01-22 07:21:55","2026-01-22 07:21:55",
806,7,N084,"INDIAN COLLEGE  OF NURSING, BELLARY",,0,P,0,1,,,"2026-01-22 07:21:55","2026-01-22 07:21:55",
807,7,N215,"INDIAN INSTITUTE OF NURSING, BENGALURU",,0,P,0,1,,,"2026-01-22 07:21:55","2026-01-22 07:21:55",
808,7,N144,INDIANA COLLEGE OF NURSING,,0,P,0,1,,,"2026-01-22 07:21:55","2026-01-22 07:21:55",
809,7,N298,INDIRA COLLEGE OF NURSING,,0,P,0,1,,,"2026-01-22 07:21:55","2026-01-22 07:21:55",
810,7,N140,INDIRA GANDHI COLLEGE OF NURSING,,0,P,0,1,,,"2026-01-22 07:21:55","2026-01-22 07:21:55",
811,7,N581,INDIRA GANDHI INSTITUTE OF CHILD HEALTH,,0,P,0,1,,,"2026-01-22 07:21:55","2026-01-22 07:21:55",
812,7,N488,INDIRA PRIYADARSHINI COLLEGE OF NURSING,,0,P,0,1,,,"2026-01-22 07:21:55","2026-01-22 07:21:55",
813,7,N022,J S S COLLEGE OF NURSING,,0,P,0,1,,,"2026-01-22 07:21:55","2026-01-22 07:21:55",
814,7,N413,JAHAN INSTITUTE OF NURSING SCIENCES,,0,P,0,1,,,"2026-01-22 07:21:55","2026-01-22 07:21:55",
815,7,N574,JANAPRIYA COLLEGE OF NURSING,,0,P,0,1,,,"2026-01-22 07:21:55","2026-01-22 07:21:55",
816,7,N558,JASMINE COLLEGE OF NURSING,,0,P,0,1,,,"2026-01-22 07:21:55","2026-01-22 07:21:55",
817,7,N094,JES MOTHER TERESA COLLEGE OF NURSING,,0,P,0,1,,,"2026-01-22 07:21:55","2026-01-22 07:21:55",
818,7,N573,JHANHAVI INSTITUTE OF NURSING SCIENCES,,0,P,0,1,,,"2026-01-22 07:21:55","2026-01-22 07:21:55",
819,7,N309,JOSCO COLLEGE OF NURSING,,0,P,0,1,,,"2026-01-22 07:21:55","2026-01-22 07:21:55",
820,7,N567,JSS COLLEGE OF NURSING,,0,P,0,1,,,"2026-01-22 07:21:55","2026-01-22 07:21:55",
821,7,N423,JUBILEE MISSION COLLEGE OF NURSING,,0,P,0,1,,,"2026-01-22 07:21:55","2026-01-22 07:21:55",
822,7,N259,JUPITER COLLEGE OF NURSING,,0,P,0,1,,,"2026-01-22 07:21:55","2026-01-22 07:21:55",
823,7,NF204,K K E C S COLLEGE OF NURSING,,0,P,0,1,,,"2026-01-22 07:21:55","2026-01-22 07:21:55",
824,7,N102,K L E INSTITUTE OF NURSING SCIENCES,,0,P,0,1,,,"2026-01-22 07:21:55","2026-01-22 07:21:55",
825,7,N256,K N N COLLEGE OF NURSING,,0,P,0,1,,,"2026-01-22 07:21:55","2026-01-22 07:21:55",
826,7,N013,K PANDYARAJAH BALLAL NURSING INSTITUTE COLLEGE OF NURSING,,0,P,0,1,,,"2026-01-22 07:21:55","2026-01-22 07:21:55",
827,7,N219,K R COLLEGE OF NURSING,,0,P,0,1,,,"2026-01-22 07:21:55","2026-01-22 07:21:55",
828,7,N508,K S COLLEGE OF NURSING,,0,P,0,1,,,"2026-01-22 07:21:55","2026-01-22 07:21:55",
829,7,N592,K V C COLLEGE OF NURSING,,0,P,0,1,,,"2026-01-22 07:21:55","2026-01-22 07:21:55",
830,7,N496,K.K. COLLEGE OF NURSING,,0,P,0,1,,,"2026-01-22 07:21:55","2026-01-22 07:21:55",
831,7,N555,K.V.  HANCHINAL COLLEGE OF NURSING,,0,P,0,1,,,"2026-01-22 07:21:55","2026-01-22 07:21:55",
832,7,N375,K.V.G. INSTITUTE OF NURSING SCIENCES,,0,P,0,1,,,"2026-01-22 07:21:55","2026-01-22 07:21:55",
833,7,N314,KAILKERE RUKMINI SHETTY MEMORIAL COLLEGE OF NURSING,,0,P,0,1,,,"2026-01-22 07:21:55","2026-01-22 07:21:55",
834,7,NF123,KALA - NIKETAN COLLEGE OF NURSING,,0,P,0,1,,,"2026-01-22 07:21:55","2026-01-22 07:21:55",
835,7,N476,KALIPALYA CHANAPPA INSTITUTE OF NURSING,,0,P,0,1,,,"2026-01-22 07:21:55","2026-01-22 07:21:55",
836,7,N209,KAMALA COLLEGE OF NURSING,,0,P,0,1,,,"2026-01-22 07:21:55","2026-01-22 07:21:55",
837,7,N287,KAMALA KRISHNA ROYALE NURSING COLLEGE,,0,P,0,1,,,"2026-01-22 07:21:55","2026-01-22 07:21:55",
838,7,N373,KANACHUR COLLEGE OF NURSING SCIENCES,,0,P,0,1,,,"2026-01-22 07:21:55","2026-01-22 07:21:55",
839,7,N115,KARAVALI COLLEGE OF NURSING,,0,P,0,1,,,"2026-01-22 07:21:55","2026-01-22 07:21:55",
840,7,NF125,KARNATAKA COLLEGE OF NURSING,,0,P,0,1,,,"2026-01-22 07:21:55","2026-01-22 07:21:55",
841,7,N372,KARNATAKA HEALTH INSTITUTE,,0,P,0,1,,,"2026-01-22 07:21:55","2026-01-22 07:21:55",
842,7,N041,KEERTHI COLLEGE OF NURSING,,0,P,0,1,,,"2026-01-22 07:21:55","2026-01-22 07:21:55",
843,7,N048,KEMPEGOWDA COLLEGE OF NURSING,,0,P,0,1,,,"2026-01-22 07:21:55","2026-01-22 07:21:55",
844,7,N350,KHAJA BANDA NAWAZ COLLEGE OF NURSING,,0,P,0,1,,,"2026-01-22 07:21:55","2026-01-22 07:21:55",
845,7,N354,KIDWAI MEMORIAL INSTITUTE OF ONCOLOGY,,0,P,0,1,,,"2026-01-22 07:21:55","2026-01-22 07:21:55",
846,7,N278,KIRAN COLLEGE OF NURSING,,0,P,0,1,,,"2026-01-22 07:21:55","2026-01-22 07:21:55",
847,7,N562,"KLE SOCIETY’S  INSTITUTE OF NURSING SCIENCES, ANKOLA",,0,P,0,1,,,"2026-01-22 07:21:55","2026-01-22 07:21:55",
848,7,N561,KLE SOCIETY’S CENTENARY INSTITUTE OF NURSING SCIENCES,,0,P,0,1,,,"2026-01-22 07:21:55","2026-01-22 07:21:55",
849,7,N563,"KLE SOCIETY’S INSTITUTE  OF NURSING SCIENCES, GOKAK",,0,P,0,1,,,"2026-01-22 07:21:55","2026-01-22 07:21:55",
850,7,N087,"KLE SOCIETY’S INSTITUTE OF NURSING SCIENCES, CHIKODI",,0,P,0,1,,,"2026-01-22 07:21:55","2026-01-22 07:21:55",
851,7,N472,KODAGU INSTITUTE OF MEDICAL SCIENCES,,1,P,0,1,,,"2026-01-22 07:21:55","2026-01-22 07:21:55",
852,7,N489,KOPPAL INSTITUTE OF NURSING SCIENCES,,0,P,0,1,,,"2026-01-22 07:21:55","2026-01-22 07:21:55",
853,7,NF100,KOSHYS COLLEGE OF NURSING,,0,P,0,1,,,"2026-01-22 07:21:55","2026-01-22 07:21:55",
854,7,N431,KRIPA INSTITUTE OF NURSING SCIENCES,,0,P,0,1,,,"2026-01-22 07:21:55","2026-01-22 07:21:55",
855,7,NF135,KRISHNA NURSING COLLEGE,,0,P,0,1,,,"2026-01-22 07:21:55","2026-01-22 07:21:55",
856,7,N128,KRUPANIDHI COLLEGE OF NURSING,,0,P,0,1,,,"2026-01-22 07:21:55","2026-01-22 07:21:55",
857,7,N031,KTG COLLEGE OF NURSING SCIENCES,,0,P,0,1,,,"2026-01-22 07:21:55","2026-01-22 07:21:55",
858,7,NF144,KUMUDA INSTITUTE OF NURSING SCIENCES,,0,P,0,1,,,"2026-01-22 07:21:55","2026-01-22 07:21:55",
859,7,N589,KUSHMA COLLEGE OF NURSING,,0,P,0,1,,,"2026-01-22 07:21:55","2026-01-22 07:21:55",
860,7,N427,LAASYA COLLEGE OF NURSING,,0,P,0,1,,,"2026-01-22 07:21:55","2026-01-22 07:21:55",
861,7,NF294,LAKESIDE COLLEGE OF NURSING,,0,P,0,1,,,"2026-01-22 07:21:55","2026-01-22 07:21:55",
862,7,N610,LAKEVIEW COLLEGE OF NURSING,,0,P,0,1,,,"2026-01-22 07:21:55","2026-01-22 07:21:55",
863,7,N024,LAXMI MEMORIAL COLLEGE OF NURSING,,0,P,0,1,,,"2026-01-22 07:21:55","2026-01-22 07:21:55",
864,7,N125,LEELA COLLEGE OF NURSING,,0,P,0,1,,,"2026-01-22 07:21:55","2026-01-22 07:21:55",
865,7,N393,LIMA INSTITUTE OF NURSING SCIENCES,,0,P,0,1,,,"2026-01-22 07:21:55","2026-01-22 07:21:55",
866,7,N588,LINGANAGOUDA SHARANAGOUDA BAYYAPUR COLLEGE OF NURSING,,0,P,0,1,,,"2026-01-22 07:21:55","2026-01-22 07:21:55",
867,7,N004,LITTLE FLOWER COLLEGE OF NURSING,,0,P,0,1,,,"2026-01-22 07:21:55","2026-01-22 07:21:55",
868,7,N280,M E S COLLEGE OF NURSING SCIENCES,,0,P,0,1,,,"2026-01-22 07:21:55","2026-01-22 07:21:55",
869,7,NF119,M R COLLEGE OF NURSING FOR WOMEN,,0,P,0,1,,,"2026-01-22 07:21:55","2026-01-22 07:21:55",
870,7,N445,M S COLLEGE OF NURSING,,0,P,0,1,,,"2026-01-22 07:21:55","2026-01-22 07:21:55",
871,7,NF173,M V J COLLEGE OF NURSING,,0,P,0,1,,,"2026-01-22 07:21:55","2026-01-22 07:21:55",
872,7,N481,M. J. COLLEGE OF NURSING,,0,P,0,1,,,"2026-01-22 07:21:55","2026-01-22 07:21:55",
873,7,N052,MADHUGIRI SRI RAGHAVENDRA COLLEGE OF NURSING,,0,P,0,1,,,"2026-01-22 07:21:55","2026-01-22 07:21:55",
874,7,N127,MAHAGANAPATI COLLEGE OF NURSING,,0,P,0,1,,,"2026-01-22 07:21:55","2026-01-22 07:21:55",
875,7,N603,MAHARAJA COLLEGE OF NURSING,,0,P,0,1,,,"2026-01-22 07:21:55","2026-01-22 07:21:55",
876,7,NF105,MAHATMA GANDHI PROFESSIONAL COLLEGE OF NURSING,,0,P,0,1,,,"2026-01-22 07:21:55","2026-01-22 07:21:55",
877,7,N617,MAHIMA COLLEGE OF NURSING,,0,P,0,1,,,"2026-01-22 07:21:55","2026-01-22 07:21:55",
878,7,N054,MALLIGE COLLEGE OF NURSING,,0,P,0,1,,,"2026-01-22 07:21:55","2026-01-22 07:21:55",
879,7,NF155,MANASA COLLEGE OF NURSING,,0,P,0,1,,,"2026-01-22 07:21:55","2026-01-22 07:21:55",
880,7,N518,MANDYA INSTITUTE OF NURSING SCIENCES,,0,P,0,1,,,"2026-01-22 07:21:55","2026-01-22 07:21:55",
881,7,NF004,MANGALA COLLEGE OF NURSING,,0,P,0,1,,,"2026-01-22 07:21:55","2026-01-22 07:21:55",
882,7,N305,MANGALORE COLLEGE OF NURSING,,0,P,0,1,,,"2026-01-22 07:21:55","2026-01-22 07:21:55",
883,7,N088,MANJUNATH COLLEGE OF NURSING,,0,P,0,1,,,"2026-01-22 07:21:55","2026-01-22 07:21:55",
884,7,NF137,MANJUSHREE COLLEGE OF NURSING,,0,P,0,1,,,"2026-01-22 07:21:55","2026-01-22 07:21:55",
885,7,N360,MANONIDHI INSTITUTE OF NURSING,,0,P,0,1,,,"2026-01-22 07:21:55","2026-01-22 07:21:55",
886,7,N539,MARGADARSHAN COLLEGE OF NURSING,,0,P,0,1,,,"2026-01-22 07:21:55","2026-01-22 07:21:55",
887,7,N532,MARUTHI COLLEGE OF NURSING,,0,P,0,1,,,"2026-01-22 07:21:55","2026-01-22 07:21:55",
888,7,NF161,MASOOD COLLEGE OF NURSING,,0,P,0,1,,,"2026-01-22 07:21:55","2026-01-22 07:21:55",
889,7,N612,MATHRUSHREE INSTITUTE OF NURSING,,0,P,0,1,,,"2026-01-22 07:21:55","2026-01-22 07:21:55",
890,7,N232,MATRU COLLEGE OF NURSING,,0,P,0,1,,,"2026-01-22 07:21:55","2026-01-22 07:21:55",
891,7,N443,MEDI CARE INSTITUTE OF NURSING SCIENCES,,0,P,0,1,,,"2026-01-22 07:21:55","2026-01-22 07:21:55",
892,7,N551,METROUNITED NURSING COLLEGE,,0,P,0,1,,,"2026-01-22 07:21:55","2026-01-22 07:21:55",
893,7,N075,MIRANDA COLLEGE OF NURSING,,0,P,0,1,,,"2026-01-22 07:21:55","2026-01-22 07:21:55",
894,7,N491,MOODLAKATTE COLLEGE OF NURSING,,0,P,0,1,,,"2026-01-22 07:21:55","2026-01-22 07:21:55",
895,7,N531,MOTHER MARY COLLEGE OF NURSING,,0,P,0,1,,,"2026-01-22 07:21:55","2026-01-22 07:21:55",
896,7,NF170,MOTHER TERESA  COLLEGE OF NURSING,,0,P,0,1,,,"2026-01-22 07:21:55","2026-01-22 07:21:55",
897,7,N067,MOTHER THERESA COLLEGE OF  NURSING,,0,P,0,1,,,"2026-01-22 07:21:55","2026-01-22 07:21:55",
898,7,N503,MOUNT CARMEL COLLEGE OF NURSING,,0,P,0,1,,,"2026-01-22 07:21:55","2026-01-22 07:21:55",
899,7,N204,MOUNT SHEPHERD COLLEGE OF NURSING,,0,P,0,1,,,"2026-01-22 07:21:55","2026-01-22 07:21:55",
900,7,N513,MRN INSTITUTE OF NURSING SCIENCES,,0,P,0,1,,,"2026-01-22 07:21:55","2026-01-22 07:21:55",
901,7,N452,MUDRA COLLEGE OF NURSING,,0,P,0,1,,,"2026-01-22 07:21:55","2026-01-22 07:21:55",
902,7,N240,MVM INSTITUTE OF NURSING SCIENCES,,0,P,0,1,,,"2026-01-22 07:21:55","2026-01-22 07:21:55",
903,7,N355,MYSORE MEDICAL COLLEGE & RESEARCH INSTITUTE AND COLLEGE OF NURSING,,0,P,0,1,,,"2026-01-22 07:21:55","2026-01-22 07:21:55",
904,7,NF142,MYTHRI COLLEGE OF NURSING,,0,P,0,1,,,"2026-01-22 07:21:55","2026-01-22 07:21:55",
905,7,N552,N. R. COLLEGE OF NURSING,,0,P,0,1,,,"2026-01-22 07:21:55","2026-01-22 07:21:55",
906,7,N404,NAGESH COLLEGE OF NURSING,,0,P,0,1,,,"2026-01-22 07:21:55","2026-01-22 07:21:55",
907,7,N396,NANDI INSTITUTE OF NURSING SCIENCES,,0,P,0,1,,,"2026-01-22 07:21:55","2026-01-22 07:21:55",
908,7,N296,NANDINI COLLEGE OF NURSING,,0,P,0,1,,,"2026-01-22 07:21:55","2026-01-22 07:21:55",
909,7,N252,NANJAPPA INSTITUTE OF NURSING SCIENCES,,0,P,0,1,,,"2026-01-22 07:21:55","2026-01-22 07:21:55",
910,7,N089,NARAYANA HRUDAYALAYA COLLEGE OF NURSING,,0,P,0,1,,,"2026-01-22 07:21:55","2026-01-22 07:21:55",
911,7,N141,NATIONAL COLLEGE OF NURSING,,0,P,0,1,,,"2026-01-22 07:21:55","2026-01-22 07:21:55",
912,7,N777,NAVAJEEVAN COLLEGE OF NURSING SCIENCES,,0,P,0,1,,,"2026-01-22 07:21:55","2026-01-22 07:21:55",
913,7,N294,NAVANEETHAM COLLEGE OF NURSING,,0,P,0,1,,,"2026-01-22 07:21:55","2026-01-22 07:21:55",
914,7,N019,NAVODAYA COLLEGE OF NURSING,,0,P,0,1,,,"2026-01-22 07:21:55","2026-01-22 07:21:55",
915,7,N510,NEHA NURSING COLLEGE,,0,P,0,1,,,"2026-01-22 07:21:55","2026-01-22 07:21:55",
916,7,N243,NETHAJI INSTITUTE OF NURSING SCIENCES,,0,P,0,1,,,"2026-01-22 07:21:55","2026-01-22 07:21:55",
917,7,N436,NEW ASHWINI INSTITUTE OF NURSING SCIENCES,,0,P,0,1,,,"2026-01-22 07:21:55","2026-01-22 07:21:55",
918,7,NF293,NEW CITY COLLEGE OF NURSING,,0,P,0,1,,,"2026-01-22 07:21:55","2026-01-22 07:21:55",
919,7,N145,NEW MANGALA COLLEGE OF NURSING,,0,P,0,1,,,"2026-01-22 07:21:55","2026-01-22 07:21:55",
920,7,N255,NEW MANGALORE COLLEGE OF NURSING,,0,P,0,1,,,"2026-01-22 07:21:55","2026-01-22 07:21:55",
921,7,N118,NEW NAVODAYA INSTITUTE OF NURSING,,0,P,0,1,,,"2026-01-22 07:21:55","2026-01-22 07:21:55",
922,7,N411,NEW PRAGATHI COLLEGE OF NURSING,,0,P,0,1,,,"2026-01-22 07:21:55","2026-01-22 07:21:55",
923,7,N417,NEW R K COLLEGE OF NURSING,,0,P,0,1,,,"2026-01-22 07:21:55","2026-01-22 07:21:55",
924,7,N434,NEW ROOHI COLLEGE OF NURSING,,0,P,0,1,,,"2026-01-22 07:21:55","2026-01-22 07:21:55",
925,7,N212,NEW ROYAL COLLEGE OF NURSING,,0,P,0,1,,,"2026-01-22 07:21:55","2026-01-22 07:21:55",
926,7,N281,NEW SRI SHANTHINI COLLEGE OF NURSING,,0,P,0,1,,,"2026-01-22 07:21:55","2026-01-22 07:21:55",
927,7,N105,NEW ST. JOHN’S INSTITUTE OF NURSING,,0,P,0,1,,,"2026-01-22 07:21:55","2026-01-22 07:21:55",
928,7,N569,NHF COLLEGE OF NURSING,,0,P,0,1,,,"2026-01-22 07:21:55","2026-01-22 07:21:55",
929,7,N341,NIDA COLLEGE OF NURSING,,0,P,0,1,,,"2026-01-22 07:21:55","2026-01-22 07:21:55",
930,7,N206,NIDHI COLLEGE OF NURSING,,0,P,0,1,,,"2026-01-22 07:21:55","2026-01-22 07:21:55",
931,7,N107,NIGHTINGALE COLLEGE OF NURSING,,0,P,0,1,,,"2026-01-22 07:21:55","2026-01-22 07:21:55",
932,7,N479,NIMRA COLLEGE OF NURSING,,0,P,0,1,,,"2026-01-22 07:21:55","2026-01-22 07:21:55",
933,7,N624,NIRA MAYA COLLEGE OF NURSING,,0,P,0,1,,,"2026-01-22 07:21:55","2026-01-22 07:21:55",
934,7,N147,NIRMALA COLLEGE OF NURSING,,0,P,0,1,,,"2026-01-22 07:21:55","2026-01-22 07:21:55",
935,7,NF147,NISARGA COLLEGE OF NURSING,,0,P,0,1,,,"2026-01-22 07:21:55","2026-01-22 07:21:55",
936,7,N178,NOOR COLLEGE OF NURSING,,0,P,0,1,,,"2026-01-22 07:21:55","2026-01-22 07:21:55",
937,7,N042,NOORIE COLLEGE OF NURSING,,0,P,0,1,,,"2026-01-22 07:21:55","2026-01-22 07:21:55",
938,7,N244,NRR HOSPITAL COLLEGE OF NURSING,,0,P,0,1,,,"2026-01-22 07:21:55","2026-01-22 07:21:55",
939,7,N357,O P JINDAL COLLEGE OF NURSING,,0,P,0,1,,,"2026-01-22 07:21:55","2026-01-22 07:21:55",
940,7,N271,OCEAN COLLEGE OF NURSING,,0,P,0,1,,,"2026-01-22 07:21:55","2026-01-22 07:21:55",
941,7,N613,OM COLLEGE OF NURSING,,0,P,0,1,,,"2026-01-22 07:21:55","2026-01-22 07:21:55",
942,7,N073,ORIENTAL COLLEGE OF NURSING,,0,P,0,1,,,"2026-01-22 07:21:55","2026-01-22 07:21:55",
943,7,N112,OXFORD COLLEGE OF NURSING SCIENCES,,0,P,0,1,,,"2026-01-22 07:21:55","2026-01-22 07:21:55",
944,7,N439,P M S COLLEGE OF NURSING,,0,P,0,1,,,"2026-01-22 07:21:55","2026-01-22 07:21:55",
945,7,N304,P R COLLEGE OF NURSING,,0,P,0,1,,,"2026-01-22 07:21:55","2026-01-22 07:21:55",
946,7,N339,P V S COLLEGE OF NURSING,,0,P,0,1,,,"2026-01-22 07:21:55","2026-01-22 07:21:55",
947,7,N293,PADMASHREE INSTITUTE OF NURSING,,0,P,0,1,,,"2026-01-22 07:21:55","2026-01-22 07:21:55",
948,7,N430,PARAMANANDA COLLEGE OF NURSING,,0,P,0,1,,,"2026-01-22 07:21:55","2026-01-22 07:21:55",
949,7,N120,PARSHWANATH DODDANNAVAR BHARATESH COLLEGE OF NURSING,,0,P,0,1,,,"2026-01-22 07:21:55","2026-01-22 07:21:55",
950,7,N263,PATEL COLLEGE OF NURSING,,0,P,0,1,,,"2026-01-22 07:21:55","2026-01-22 07:21:55",
951,7,N230,PAVANA COLLEGE OF NURSING,,0,P,0,1,,,"2026-01-22 07:21:55","2026-01-22 07:21:55",
952,7,N346,PG COLLEGE OF NURSING,,0,P,0,1,,,"2026-01-22 07:21:55","2026-01-22 07:21:55",
953,7,N619,PHOENIX INSTITUTE OF NURSING,,0,P,0,1,,,"2026-01-22 07:21:55","2026-01-22 07:21:55",
954,7,N590,POORNAA PRAGNA COLLEGE OF NURSING,,0,P,0,1,,,"2026-01-22 07:21:55","2026-01-22 07:21:55",
955,7,N268,PRAGATHI INSTITUTE OF NURSING,,0,P,0,1,,,"2026-01-22 07:21:55","2026-01-22 07:21:55",
956,7,NF169,PRAJNA COLLEGE OF NURSING,,0,P,0,1,,,"2026-01-22 07:21:55","2026-01-22 07:21:55",
957,7,NF126,PRAJWAL COLLEGE OF NURSING,,0,P,0,1,,,"2026-01-22 07:21:55","2026-01-22 07:21:55",
958,7,N233,PRASANNA COLLEGE OF  NURSING,,0,P,0,1,,,"2026-01-22 07:21:55","2026-01-22 07:21:55",
959,7,N387,PRAYAVI COLLEGE OF NURSING,,0,P,0,1,,,"2026-01-22 07:21:55","2026-01-22 07:21:55",
960,7,N277,PREMIER COLLEGE OF NURSING,,0,P,0,1,,,"2026-01-22 07:21:55","2026-01-22 07:21:55",
961,7,N247,PRESIDENCY COLLEGE OF NURSING,,0,P,0,1,,,"2026-01-22 07:21:55","2026-01-22 07:21:55",
962,7,N388,PRESTIGE COLLEGE OF NURSING,,0,P,0,1,,,"2026-01-22 07:21:55","2026-01-22 07:21:55",
963,7,N223,PRINCE COLLEGE OF NURSING,,0,P,0,1,,,"2026-01-22 07:21:55","2026-01-22 07:21:55",
964,7,N492,PRITHVI COLLEGE OF NURSING,,0,P,0,1,,,"2026-01-22 07:21:55","2026-01-22 07:21:55",
